{
  "schema_version": 1,
  "products": [
    {
      "schema_version": 1,
      "id": "demo",
      "display_name": "Demo",
      "description": "Initial publication binding fixture.",
      "manifest_name": "demo",
      "aliases": ["demo"],
      "reserved_aliases": ["demo"],
      "categories": ["demo"],
      "minimum_capabilities": {"skills": "optional", "mcp": "required"},
      "default_distribution": "example/demo",
      "distributions": ["example/demo"]
    }
  ],
  "distributions": [
    {
      "schema_version": 1,
      "id": "example/demo",
      "product_id": "demo",
      "kind": "community",
      "status": "active",
      "packager": "example",
      "releases": [
        {
          "sequence": 1,
          "package_version": "1.0.0",
          "manifest_name": "demo",
          "agent_plugins_schema": "https://agent-plugins.org/schemas/1.0.0/plugin.schema.json",
          "package_source": {"repository": "example/uap", "revision": "0000000000000000000000000000000000000000", "path": "plugins/demo"},
          "tree_digest_algorithm": "uap-tree-sha256-v1",
          "tree_digest": "sha256:0000000000000000000000000000000000000000000000000000000000000000",
          "manifest_digest": "sha256:0000000000000000000000000000000000000000000000000000000000000000",
          "components": ["mcp"],
          "published_at": "2025-01-02T03:04:05Z"
        },
        {
          "sequence": 2,
          "package_version": "2.0.0",
          "manifest_name": "demo",
          "agent_plugins_schema": "https://agent-plugins.org/schemas/1.0.0/plugin.schema.json",
          "package_source": {"repository": "example/uap", "revision": null, "path": "plugins/demo"},
          "tree_digest_algorithm": "uap-tree-sha256-v1",
          "tree_digest": "sha256:0000000000000000000000000000000000000000000000000000000000000000",
          "manifest_digest": "sha256:0000000000000000000000000000000000000000000000000000000000000000",
          "components": ["mcp"]
        }
      ],
      "release_policies": [
        {"release_sequence": 1, "status": "superseded", "minimum_installer_version": "0.1.6", "targets": [{"client": "codex", "scopes": ["user"], "delivery": "managed"}], "current_evidence": []},
        {"release_sequence": 2, "status": "active", "minimum_installer_version": "0.1.6", "targets": [{"client": "codex", "scopes": ["user"], "delivery": "managed"}], "current_evidence": []}
      ]
    }
  ],
  "evidence": []
}
